Action,A flawed hero single handedly faces an evil villain.
Detective,"A victim is murdered, and the book's hero is tasked with solving the crime whilst confronting his / her personal demons."
Thriller,"When the bloody body of a nameless victim is discovered, the race is on to find the killer before more innocent lives are lost."
Horror,"A top secret research project goes horribly wrong, the book's protagonist finds himself batteling inhuman monsters in order to prevent a catastrophe."
Horror,The book's progtagonist must find a way to remove the curse on a small town before it is too late
Detective,A series of puzzling deaths rocks a small community and strikes too close to home for the book's protagonist.
Thriller,A gruesome murder is quickly followed by another seemingly random killing.  Then the killer starts to taunt the police and it appears as if no-one can be trusted.
